{
  "schema_id": "eml-gr-zero-certificate-bundle",
  "schema_version": "1.2.0-draft",
  "artifact_version": "eml-gr-zero-forest-wp10-seed/0.1",
  "created_utc": "2026-06-19T00:00:00Z",
  "source_baseline": {
    "project": "EML-GR Forest",
    "baseline": "v0.44 submission preprint final package / v0.45 follow-up plan",
    "wp": "WP10 Zero forest proof language expansion"
  },
  "normalization_policy": {
    "raw_trace_hash": "sha256-16(canonical_json(route_id, route_kind, steps, final_expr, route_notes))",
    "normalized_hash": "sha256-16(canonical_json(schema_major, kind, claim_id, object_signature, domain_signature, assumptions, zero_obligation, final_normal_form, rule_classes, side_condition_refs, formal_fragment))",
    "canonical_json": "sort_keys=True,separators=(comma,colon),utf8",
    "ignored_in_normalized_hash": [
      "route_id",
      "route_kind",
      "steps",
      "raw_trace_hash",
      "route_notes",
      "backend-specific rewrite order"
    ]
  },
  "rule_registry": [
    {
      "rule_id": "ALG.ADD_ASSOC_COMM",
      "rule_class": "algebra",
      "description": "Canonical associativity/commutativity of addition.",
      "replay_semantics": "checked by scalar normal form or simplify difference",
      "formal_fragment_eligible": true
    },
    {
      "rule_id": "ALG.MUL_ASSOC_COMM",
      "rule_class": "algebra",
      "description": "Canonical associativity/commutativity of multiplication.",
      "replay_semantics": "checked by scalar normal form or simplify difference",
      "formal_fragment_eligible": true
    },
    {
      "rule_id": "ALG.ADD_INVERSE",
      "rule_class": "algebra",
      "description": "f + (-f) cancels to zero.",
      "replay_semantics": "checked by simplify(before-after)==0",
      "formal_fragment_eligible": true
    },
    {
      "rule_id": "ALG.MUL_ZERO",
      "rule_class": "algebra",
      "description": "0*f or f*0 cancels to zero.",
      "replay_semantics": "checked by simplify(before-after)==0",
      "formal_fragment_eligible": true
    },
    {
      "rule_id": "ALG.COMMON_DENOM_CANCEL",
      "rule_class": "algebra",
      "description": "a/d - a/d cancels under certified nonzero denominator.",
      "replay_semantics": "checked by simplify(before-after)==0 and domain side condition",
      "formal_fragment_eligible": true
    },
    {
      "rule_id": "ALG.EXP_CANCEL",
      "rule_class": "algebra",
      "description": "exp(a)*exp(-a) cancels on the real branch.",
      "replay_semantics": "checked by simplify(before-after)==0 with real branch side condition",
      "formal_fragment_eligible": true
    },
    {
      "rule_id": "ALG.RATIONAL_NORMAL_FORM",
      "rule_class": "algebra",
      "description": "Rational/Laurent expression normalization.",
      "replay_semantics": "checked by simplify or Laurent seed normal form",
      "formal_fragment_eligible": true
    },
    {
      "rule_id": "CALC.DIFF_POWER",
      "rule_class": "calculus",
      "description": "Derivative of integer powers.",
      "replay_semantics": "checked by sympy differentiation in exported scalar leaf",
      "formal_fragment_eligible": true
    },
    {
      "rule_id": "CALC.SECOND_DIFF_QUADRATIC",
      "rule_class": "calculus",
      "description": "Second derivative of x^2 is 2 and of -y^2 is -2.",
      "replay_semantics": "checked by sympy differentiation in exported scalar leaf",
      "formal_fragment_eligible": true
    },
    {
      "rule_id": "CALC.DIFF_EXP_LINEAR",
      "rule_class": "calculus",
      "description": "Derivative of exp(k*u) is k*exp(k*u).",
      "replay_semantics": "checked by sympy differentiation in exported scalar leaf",
      "formal_fragment_eligible": true
    },
    {
      "rule_id": "TDEF.RIEMANN_FROM_GAMMA",
      "rule_class": "tensor_definition",
      "description": "Riemann component exported from Christoffel data.",
      "replay_semantics": "declared tensor step; algebra leaf checked independently",
      "formal_fragment_eligible": false
    },
    {
      "rule_id": "TDEF.RICCI_CONTRACTION",
      "rule_class": "tensor_definition",
      "description": "Ricci component exported by contraction of Riemann.",
      "replay_semantics": "declared tensor step; algebra leaf checked independently",
      "formal_fragment_eligible": false
    },
    {
      "rule_id": "TDEF.COVARIANT_DIVERGENCE",
      "rule_class": "tensor_definition",
      "description": "Covariant divergence component expanded to scalar terms.",
      "replay_semantics": "declared tensor step; algebra leaf checked independently",
      "formal_fragment_eligible": false
    },
    {
      "rule_id": "TDEF.PPWAVE_RICCI_UU",
      "rule_class": "tensor_definition",
      "description": "pp-wave Ricci component R_uu = -1/2(H_xx+H_yy).",
      "replay_semantics": "declared tensor step; algebra leaf checked independently",
      "formal_fragment_eligible": false
    },
    {
      "rule_id": "TID.CONTRACTED_BIANCHI",
      "rule_class": "tensor_identity",
      "description": "Contracted Bianchi identity for Einstein tensor divergence.",
      "replay_semantics": "declared tensor identity; selected algebra leaf checked independently",
      "formal_fragment_eligible": false
    },
    {
      "rule_id": "DOM.NONZERO_DENOMINATOR",
      "rule_class": "domain",
      "description": "Denominator is nonzero on the certified domain.",
      "replay_semantics": "recorded as side condition; future domain checker verifies",
      "formal_fragment_eligible": true
    },
    {
      "rule_id": "DOM.POSITIVE_COORDINATE",
      "rule_class": "domain",
      "description": "Coordinate positivity condition such as rho>0 or r>2M.",
      "replay_semantics": "recorded as side condition; future domain checker verifies",
      "formal_fragment_eligible": true
    },
    {
      "rule_id": "DOM.REAL_BRANCH",
      "rule_class": "domain",
      "description": "Real branch obligations for exp/log/sqrt simplification.",
      "replay_semantics": "recorded as side condition; future branch checker verifies",
      "formal_fragment_eligible": true
    }
  ],
  "certificates": [
    {
      "kind": "zero_certificate",
      "claim_id": "zero.rindler.Riemann_eta_rho_eta_rho",
      "object_signature": {
        "geometry": "Rindler",
        "tensor": "Riemann",
        "component": "R^eta_{rho eta rho}",
        "coordinate_chart": "Rindler wedge",
        "index_convention": "EML-GR v0.44 selected component convention",
        "structural_zero": false
      },
      "assumptions": [
        "rho > 0"
      ],
      "domain": {
        "domain_id": "domain.rindler.rho_positive",
        "conditions": [
          "rho > 0"
        ],
        "side_condition_refs": [
          "DOM.POSITIVE_COORDINATE",
          "DOM.NONZERO_DENOMINATOR"
        ]
      },
      "normalized_obligation": {
        "schema_major": "1.2",
        "kind": "zero_certificate",
        "claim_id": "zero.rindler.Riemann_eta_rho_eta_rho",
        "lhs_expr": "-diff(1/rho, rho) - 1/rho**2",
        "target_normal_form": "0",
        "required_rule_classes": [
          "algebra",
          "calculus",
          "domain",
          "tensor_definition"
        ],
        "side_condition_refs": [
          "DOM.NONZERO_DENOMINATOR",
          "DOM.POSITIVE_COORDINATE"
        ],
        "formal_fragment": "tensor_skeleton_plus_algebra_leaf"
      },
      "routes": [
        {
          "route_id": "rindler_route_A_diff_then_cancel",
          "route_kind": "definition_first",
          "steps": [
            {
              "step_id": "A1",
              "rule_id": "TDEF.RIEMANN_FROM_GAMMA",
              "rule_class": "tensor_definition",
              "before_expr": "-diff(1/rho, rho) - 1/rho**2",
              "after_expr": "-diff(1/rho, rho) - 1/rho**2",
              "side_conditions": [],
              "replay_method": "declared_tensor_rule_plus_algebra_leaf",
              "trust_boundary": "declared_tensor_step",
              "notes": "Selected Riemann component exported to scalar leaf."
            },
            {
              "step_id": "A2",
              "rule_id": "CALC.DIFF_POWER",
              "rule_class": "calculus",
              "before_expr": "-diff(1/rho, rho) - 1/rho**2",
              "after_expr": "1/rho**2 - 1/rho**2",
              "side_conditions": [],
              "replay_method": "sympy_simplify_zero_difference",
              "trust_boundary": "checked_algebra_leaf",
              "notes": ""
            },
            {
              "step_id": "A3",
              "rule_id": "ALG.ADD_INVERSE",
              "rule_class": "algebra",
              "before_expr": "1/rho**2 - 1/rho**2",
              "after_expr": "0",
              "side_conditions": [
                "rho>0",
                "rho**2 != 0"
              ],
              "replay_method": "sympy_simplify_zero_difference",
              "trust_boundary": "checked_algebra_leaf",
              "notes": ""
            }
          ],
          "final_expr": "0",
          "route_notes": "Differentiate the Christoffel leaf first, then cancel.",
          "raw_trace_hash": "bd7990bdfb10fa14"
        },
        {
          "route_id": "rindler_route_B_power_form",
          "route_kind": "factored",
          "steps": [
            {
              "step_id": "B1",
              "rule_id": "TDEF.RIEMANN_FROM_GAMMA",
              "rule_class": "tensor_definition",
              "before_expr": "-diff(rho**(-1), rho) - rho**(-2)",
              "after_expr": "-diff(rho**(-1), rho) - rho**(-2)",
              "side_conditions": [],
              "replay_method": "declared_tensor_rule_plus_algebra_leaf",
              "trust_boundary": "declared_tensor_step",
              "notes": "Same scalar leaf after rewriting 1/rho as rho**(-1)."
            },
            {
              "step_id": "B2",
              "rule_id": "CALC.DIFF_POWER",
              "rule_class": "calculus",